timestamp	pattern_name	novelty	feasibility	business_value	simplicity	vertical_depth	content_value	buildability	composite	status	vertical	one_liner	sources
2026-03-27T00:01:00Z	clinical-trial-compliance-sentinel	6	8	9	8	9	7	7	7.71	keep	healthcare	Autonomous agent monitors clinical trial data events for Part 11 compliance with adaptive per-site scrutiny	https://www.dotcompliance.com/blog/regulatory-compliance/fda-21-cfr-part-11-compliance-what-you-need-to-know-in-2026/,https://www.maxisit.com/blog/ai-powered-protocol-deviation-management/,https://learn.microsoft.com/en-us/microsoft-copilot-studio/fundamentals-what-is-copilot-studio
2026-03-27T00:10:00Z	cross-facility-readmission-prevention	5	6	9	6	7	7	5	6.43	refine	healthcare	Connected agents across hospitals share minimal risk signals for readmission prevention under HIPAA	https://www.advisory.com/daily-briefing/2025/09/23/readmission-penalties,https://learn.microsoft.com/en-us/microsoft-copilot-studio/add-agent-agent-to-agent,https://pmc.ncbi.nlm.nih.gov/articles/PMC10751121/
2026-03-27T00:25:00Z	formulary-adaptive-prior-auth	7	7	9	7	8	8	7	7.57	keep	healthcare	Agent dynamically discovers and chains PA workflow skills from Dataverse based on drug-payer-formulary context	https://www.ama-assn.org/practice-management/prior-authorization/prior-authorization-delays-care-and-increases-health-care,https://intuitionlabs.ai/articles/drug-formulary-tiers-step-therapy-prior-authorization,https://www.amcp.org/concepts-managed-care-pharmacy/formulary-management
2026-03-27T00:45:00Z	surgical-safety-sentinel	3	6	8	6	8	5	5	5.86	discard	healthcare	Event-driven surgical schedule monitoring — variant of Compliance Sentinel in surgical domain	https://link.springer.com/article/10.1186/s13037-025-00474-8,https://learn.microsoft.com/en-us/semantic-kernel/frameworks/agent/agent-orchestration/
2026-03-27T01:00:00Z	kyc-jurisdiction-mesh	7	7	9	6	8	8	7	7.43	keep	financial_services	Agent dynamically selects jurisdiction-specific MCP servers for parallel KYC checks with conflict resolution	https://www.encompasscorporation.com/blog/divergence-and-demonstration-why-aml-2025-changed-the-rules-for-financial-institutions/,https://regtechanalyst.com/ai-set-to-transform-aml-and-kyc-in-2026/,https://learn.microsoft.com/en-us/microsoft-copilot-studio/agent-extend-action-mcp
2026-03-27T01:30:00Z	fraud-investigation-narrative	4	7	9	5	8	5	5	6.14	refine	financial_services	Autonomous fraud investigation with behavioral narrative — space saturated by Cleafy Nyx and Unit21	https://ffnews.com/newsarticle/fintech/cleafy-launches-the-first-autonomous-fraud-investigation-platform-for-banks,https://www.unit21.ai/blog/the-new-unit21-why-we-rebuilt-everything-around-ai-agents
2026-03-27T01:45:00Z	trade-settlement-ephemeral-agents	5	4	8	5	7	6	4	5.57	discard	financial_services	Dynamic agent spawning for T+1 settlement exceptions — agent creation latency too high for SLAs	https://www.deloitte.com/lu/en/our-thinking/future-of-advice/transition-from-T-2-to-T-1-securities-settlement-cycle.html,https://learn.microsoft.com/en-us/microsoft-copilot-studio/agent-extend-action-rest-api
2026-03-27T02:00:00Z	sox-continuous-controls	7	8	9	7	8	8	7	7.71	keep	financial_services	Dual-paradigm agent spans native Dataverse tables and virtual tables for continuous 100% SOX control testing	https://safebooks.ai/resources/sox-compliance/sox-compliance-a-new-era-of-financial-data-transparency/,https://learn.microsoft.com/en-us/dynamics365/fin-ops-core/dev-itpro/power-platform/virtual-entities-overview,https://www.grantthornton.com/insights/articles/advisory/2025/the-power-of-ai-in-efficient-sox-compliance
2026-03-27T02:30:00Z	lot-genealogy-rpa-agent	7	7	8	6	9	8	6	7.29	keep	manufacturing	Agent uses RPA desktop flows as tentacles into legacy MES/SCADA for complete lot genealogy and root cause analysis	https://www.barcodeindia.com/blogs/traceability-in-manufacturing,https://datagrid.com/blog/ai-agents-automate-manufacturing-root-cause-analysis-quality-assurance-directors,https://converged.propelsoftware.com/blogs/qms-for-manufacturing-how-legacy-systems-are-failing-modern-companies
2026-03-27T03:00:00Z	eco-multi-plant-a2a	4	6	7	6	7	5	5	5.71	discard	manufacturing	Multi-plant ECO sync via A2A — variant of KYC Jurisdiction Mesh pattern with plants instead of jurisdictions	https://www.rootstock.com/cloud-erp-blog/guide-to-engineering-change-management/,https://visuresolutions.com/plm-guide/best-bom-management-tools/
2026-03-27T03:10:00Z	energy-aware-maintenance	4	7	7	6	7	5	6	6.00	refine	manufacturing	Energy-aware maintenance prioritization — predictive maintenance market too mature for architectural novelty	https://ifactoryapp.com/blog/predictive-maintenance-2026-ai-factory-downtime,https://www.alphabold.com/ai-powered-predictive-maintenance-in-manufacturing/
2026-03-27T03:20:00Z	recall-readiness-tracer	4	7	9	6	8	6	6	6.57	refine	manufacturing	Forward lot traceability for recall readiness — variant of Lot Genealogy RPA Agent	N/A
2026-03-27T03:30:00Z	perishable-markdown-cascade	4	7	8	6	7	6	6	6.29	refine	retail	Time-decay perishable markdown — variant of Adaptive Scrutiny applied to retail pricing	https://www.wasteless.com/,https://www.foodlogistics.com/sustainability/waste-reduction/article/22918098/wasteless-ai-the-food-waste-problem-in-the-grocery-retail-industry
2026-03-27T03:40:00Z	franchise-returns-connected	4	6	7	6	6	5	5	5.57	discard	retail	Franchise returns via connected agents — variant of Jurisdiction Mesh applied to retail franchise policies	N/A
2026-03-27T03:50:00Z	shrinkage-weighted-scheduling	3	5	7	6	6	5	4	5.14	discard	retail	Shrinkage-weighted labor scheduling — risk-based staffing is known concept, computer use is RPA variant	https://www.buildingsecurity.com/statistics/retail-theft/,https://nrf.com/research/the-impact-of-retail-theft-violence-2025
2026-03-27T04:00:00Z	trust-bounded-vmi	4	6	7	7	6	5	5	5.71	discard	retail	Trust-bounded VMI via connected agents — standard API design principles applied to agent boundaries	N/A
2026-03-27T04:15:00Z	multi-timescale-energy	5	6	8	5	9	8	5	6.57	refine	energy	Multi-timescale state machine for demand response — concept well-studied in academic MARL research	https://www.sciencedirect.com/science/article/abs/pii/S0306261922017573,https://www.utilitydive.com/news/in-2026-virtual-power-plants-must-scale-or-risk-being-left-behind/810321/
2026-03-27T04:30:00Z	carbon-credit-provenance	4	7	8	6	7	6	5	6.14	refine	energy	Carbon credit provenance — variant of Jurisdiction Mesh + SOX Controls for ESG reconciliation	https://www.regreener.earth/blog/carbon-credit-prices-today-trends-and-forecasts-for-2026/,https://link.springer.com/article/10.1007/s43621-025-01044-9